{
  "blocking_ready_checks": [
    "schema_compile",
    "safe_fixture_validation",
    "registry_id_uniqueness",
    "release_manifest_hashes"
  ],
  "contracts": {
    "profile_gap_confirmed_v1": {
      "schema_path": "schemas/profile_gap_confirmed.v1.schema.json",
      "schema_version": "ecocheck.profile_gap_confirmed.v1"
    },
    "semantic_event_v2": {
      "schema_path": "schemas/semantic_event.v2.schema.json",
      "schema_version": "ecocheck.semantic_event.v2"
    }
  },
  "generated_by": {
    "generator": "scripts/generate-projections.mjs",
    "generator_version": "1",
    "ontology_version": "0.1.0",
    "source_sha256": {
      "registries/entity_anchors.v1.json": "470226b92978a5b08da41e1e645f406322ce58de9b33574bff120f7ec40ecd0e",
      "registries/issue_types.v1.json": "a7942f83fcba1743c0a217a51fc63c85512762392a7d6890ea85aa31288e7a61",
      "registries/legal_basis_ref.v1.json": "708122b14a033f1a78745bec146589952eb29e99aa7c4e0a37e859752acfcd51",
      "registries/observed_signals.v1.json": "7513983195632a96983cce58a79abfb746cb42bea07b35d346af3b572b10e2af",
      "registries/risk_domains.v1.json": "289481405660f4e275f200d86b6b25575d470693ac9e73ba4926010d4938297b",
      "schemas/kb_product_manifest.v1.schema.json": "d13cabd36eb1c7a1c47f96b52e68f6992fcf214a346e4a36872e83de7a5218b3",
      "schemas/ontology_registry.v1.schema.json": "0fc8acd05ca67c7d210d52b135da2283f1e6f2e80c598c4fe4bad7e7c1e03076",
      "schemas/profile_gap_confirmed.v1.schema.json": "1a1a3901fb22b8121d7b88b3c9d75633598275a2559b62c77146bae1d756f383",
      "schemas/semantic_event.v2.schema.json": "e7f324b22fb0c51bc2c32b8c7857f60d6024d1737a8935d4905209c142c5994c"
    }
  },
  "registries": {
    "entity_anchor_ids": [
      "anchor.enterprise",
      "anchor.facility",
      "anchor.emission_point",
      "anchor.waste_storage_area",
      "anchor.material_or_substance",
      "anchor.document",
      "anchor.legal_basis",
      "anchor.monitoring_device",
      "anchor.discharge_outlet",
      "anchor.permit"
    ],
    "issue_type_ids": [
      "issue.missing_permit_or_approval",
      "issue.uncontrolled_emission_or_discharge",
      "issue.incomplete_monitoring_record",
      "issue.improper_waste_storage",
      "issue.facility_abnormal_operation",
      "issue.incomplete_rectification",
      "issue.entity_profile_gap",
      "issue.unknown_or_needs_review"
    ],
    "legal_basis_ref_ids": [
      "legal_ref.law",
      "legal_ref.regulation",
      "legal_ref.standard",
      "legal_ref.clause",
      "legal_ref.local_policy"
    ],
    "observed_signal_ids": [
      "signal.photo_point_present",
      "signal.ledger_or_record_present",
      "signal.monitoring_value_present",
      "signal.operator_statement_present",
      "signal.facility_state_abnormal",
      "signal.boundary_condition_unknown",
      "signal.rectification_evidence_present",
      "signal.quantitative_exceedance_present"
    ],
    "risk_domain_ids": [
      "S01",
      "S02",
      "S03",
      "S04",
      "S05",
      "S06",
      "S07",
      "S08",
      "S09",
      "S10",
      "S11",
      "S12",
      "S13"
    ]
  },
  "registry_labels": {
    "entity_anchors": [
      {
        "aliases": [
          "排污单位",
          "排污企业",
          "生产经营单位",
          "监管企业",
          "受监管企业",
          "企业"
        ],
        "display_name": "Enterprise",
        "display_name_zh": "企业主体",
        "id": "anchor.enterprise"
      },
      {
        "aliases": [
          "生产设施",
          "污染治理设施",
          "污染防治设施",
          "治污设施",
          "环保设施",
          "装置"
        ],
        "display_name": "Facility",
        "display_name_zh": "设施",
        "id": "anchor.facility"
      },
      {
        "aliases": [
          "排污口",
          "排放源",
          "排气筒",
          "废气排放口",
          "废水排放口",
          "噪声源"
        ],
        "display_name": "Emission point",
        "display_name_zh": "排放口",
        "id": "anchor.emission_point"
      },
      {
        "aliases": [
          "固废贮存场所",
          "危废暂存间",
          "危险废物贮存设施",
          "固体废物堆场",
          "危废暂存库",
          "贮存场所"
        ],
        "display_name": "Waste storage area",
        "display_name_zh": "废物贮存场所",
        "id": "anchor.waste_storage_area"
      },
      {
        "aliases": [
          "原辅材料",
          "污染物",
          "危险化学品",
          "化学物质",
          "原料",
          "辅料",
          "废物"
        ],
        "display_name": "Material or substance",
        "display_name_zh": "物料与物质",
        "id": "anchor.material_or_substance"
      },
      {
        "aliases": ["文档", "资料", "台账", "档案", "环保资料"],
        "display_name": "Document",
        "display_name_zh": "文件",
        "id": "anchor.document"
      },
      {
        "aliases": [
          "法规依据",
          "合规依据",
          "法律法规依据",
          "标准规范",
          "政策依据"
        ],
        "display_name": "Legal basis",
        "display_name_zh": "法律依据",
        "id": "anchor.legal_basis"
      },
      {
        "aliases": [
          "在线监测设备",
          "自动监测设备",
          "监测仪器",
          "监控设备",
          "自动监控设施"
        ],
        "display_name": "Monitoring device",
        "display_name_zh": "监测设备",
        "id": "anchor.monitoring_device"
      },
      {
        "aliases": [
          "排放口",
          "排口",
          "废水排放口",
          "废气排放口",
          "DA排气口",
          "DW排水口"
        ],
        "display_name": "Discharge outlet",
        "display_name_zh": "排污口",
        "id": "anchor.discharge_outlet"
      },
      {
        "aliases": ["排污许可", "许可证", "排污证", "环保许可", "排污许可编号"],
        "display_name": "Permit",
        "display_name_zh": "排污许可证",
        "id": "anchor.permit"
      }
    ],
    "issue_types": [
      {
        "aliases": [
          "环保手续不全",
          "证照缺失",
          "无证排污",
          "未批先建",
          "排污许可证缺失",
          "环评审批缺失",
          "环保备案缺失",
          "手续不全"
        ],
        "display_name": "Missing permit or approval",
        "display_name_zh": "许可审批缺失",
        "id": "issue.missing_permit_or_approval"
      },
      {
        "aliases": [
          "无组织排放",
          "污染物直排",
          "未经处理排放",
          "偷排偷放",
          "私设暗管",
          "废气无组织排放",
          "废水直排"
        ],
        "display_name": "Uncontrolled emission or discharge",
        "display_name_zh": "无组织排放或直排",
        "id": "issue.uncontrolled_emission_or_discharge"
      },
      {
        "aliases": [
          "自行监测不到位",
          "在线监测缺失",
          "监测台账不全",
          "监测数据缺失",
          "自行监测记录缺失",
          "监测报告缺失"
        ],
        "display_name": "Incomplete monitoring record",
        "display_name_zh": "监测记录不全",
        "id": "issue.incomplete_monitoring_record"
      },
      {
        "aliases": [
          "危废贮存不规范",
          "危险废物贮存不规范",
          "固废分类存放不规范",
          "危废标识不全",
          "危废台账不全",
          "贮存场所不规范",
          "三防措施不到位"
        ],
        "display_name": "Improper waste storage",
        "display_name_zh": "固体废物贮存不规范",
        "id": "issue.improper_waste_storage"
      },
      {
        "aliases": [
          "污染防治设施不正常运行",
          "治污设施停运",
          "治污设施闲置",
          "私设旁路",
          "环保设施异常运行",
          "治污设施擅自停运"
        ],
        "display_name": "Facility abnormal operation",
        "display_name_zh": "治污设施不正常运行",
        "id": "issue.facility_abnormal_operation"
      },
      {
        "aliases": [
          "整改不到位",
          "整改未完成",
          "整改未销号",
          "复查未通过",
          "整改证据不全",
          "问题未闭环"
        ],
        "display_name": "Incomplete rectification",
        "display_name_zh": "整改未闭环",
        "id": "issue.incomplete_rectification"
      },
      {
        "aliases": [
          "企业画像信息缺失",
          "企业适用性信息缺失",
          "企业基础信息缺失",
          "企业档案缺项"
        ],
        "display_name": "Entity profile gap",
        "display_name_zh": "企业档案信息缺失",
        "id": "issue.entity_profile_gap"
      },
      {
        "aliases": [
          "待人工研判",
          "需人工复核",
          "未分类问题",
          "待确认问题",
          "疑似问题待核实"
        ],
        "display_name": "Unknown or needs review",
        "display_name_zh": "未知或待复核",
        "id": "issue.unknown_or_needs_review"
      }
    ],
    "legal_basis_ref": [
      {
        "aliases": ["法律条文引用", "法律级引用", "法律级依据"],
        "display_name": "Law reference",
        "display_name_zh": "法律引用",
        "id": "legal_ref.law"
      },
      {
        "aliases": ["法规引用", "行政法规依据", "法规依据", "部门规章引用"],
        "display_name": "Regulation reference",
        "display_name_zh": "行政法规引用",
        "id": "legal_ref.regulation"
      },
      {
        "aliases": ["技术标准引用", "标准依据", "环保标准引用", "排放标准引用"],
        "display_name": "Standard reference",
        "display_name_zh": "标准引用",
        "id": "legal_ref.standard"
      },
      {
        "aliases": ["条文引用", "法条引用", "具体条款引用", "章节条款引用"],
        "display_name": "Clause reference",
        "display_name_zh": "条款引用",
        "id": "legal_ref.clause"
      },
      {
        "aliases": [
          "地方环保政策",
          "地方管理要求",
          "地方规范性文件",
          "地方政策依据"
        ],
        "display_name": "Local policy reference",
        "display_name_zh": "地方政策引用",
        "id": "legal_ref.local_policy"
      }
    ],
    "observed_signals": [
      {
        "aliases": [
          "现场照片",
          "照片点位",
          "拍照取证",
          "影像资料",
          "现场影像资料",
          "现场取证照片"
        ],
        "display_name": "Photo point present",
        "display_name_zh": "现场照片存在",
        "id": "signal.photo_point_present"
      },
      {
        "aliases": [
          "台账",
          "台账记录",
          "运行记录",
          "管理台账",
          "环保台账",
          "登记台账"
        ],
        "display_name": "Ledger or record present",
        "display_name_zh": "台账或记录存在",
        "id": "signal.ledger_or_record_present"
      },
      {
        "aliases": [
          "监测数据",
          "检测数据",
          "监测值",
          "检测值",
          "监测结果",